meal_description,carb,protein,fat,energy
I treated myself to a delightful snack of 58g of giant snail that was freshly fried.,0.014928333570979231,0.4578754578754578,0.020676536266644608,0.11640211640211641
"I started my day with a nutritious 271g bowl of quinoa made with apples and a hint of sugar, paired with a small 8g slice of bread that included egg yolk.",0.11889978620650517,0.038628038628038625,0.0068921787555482035,0.08994708994708996
"I snacked on 111.5g of sweet corn today, savoring it with the peel for extra texture.",0.38528272672159636,0.10589410589410589,0.014387423152206874,0.291005291005291
"For my evening meal, I savored 12g of bonito that had been fried to perfection.",0.002414877489423111,0.0636030636030636,0.011199790477765832,0.021164021164021163
"Today for my snack, I treated myself to 172.4g of water-based porridge, freshly made by a street vendor.",0.5374200085552524,0.0889110889110889,0.08615223444435255,0.25396825396825395
"For my snack, I had 30g of sugar-coated dragées made with milk chocolate.",0.09879044274912727,0.0,0.032307087916632206,0.11337868480725624
"I treated myself to a 4g serving of lupins, which were without pods, for my snack.",0.0030295735776399027,0.011488511488511486,0.006030656411104678,0.008314436885865457
My snack today featured a tasty 39.5g of hakes.,0.0,0.1302031302031302,0.0013784357511096408,0.026455026455026457
"For my snack, I indulged in 5g of sugar-coated dragée with a delicious caramel filling.",0.02195343172202828,0.0,0.0,0.015117157974300832
"For my snack, I had 48.3g of Andigena cheese along with 10g of fresh uncured cheese.",0.048736618422902785,0.045954045954045945,0.017747360295536623,0.05517762660619804
I enjoyed 38.3g of fried weakfish for my dinner tonight.,0.0,0.19996669996669994,0.0026707192677749288,0.04081632653061225
"During my afternoon snack, I enjoyed 235g of peach nectar along with 29g of delicious fried bread dough sold by a street vendor.",0.17597870868377868,0.024975024975024972,0.0404915501888457,0.15721844293272866
"During my snack time, I enjoyed a small portion of 7g of processed maize-based flakes, enriched with vitamins and minerals, and lightly sweetened.",0.026739279837430446,0.006993006993006992,0.0008615223444435254,0.01889644746787604
"Today, my snack included 50g of crispy fried eggs, a delightful way to fuel my day.",0.004522406934737826,0.1292041292041292,0.04161152923662228,0.061224489795918366
"My afternoon snack consisted of 22.2g of fresh chicken wing meat, which was quite satisfying.",0.0,0.07609057609057608,0.0068921787555482035,0.020408163265306124
I enjoyed a satisfying dinner featuring 69.6g of fresh chicken leg.,0.0,0.23876123876123873,0.021624210845532486,0.06349206349206349
"At dinner time, I prepared 71g of fresh chicken breast.",0.0,0.22677322677322673,0.017747360295536623,0.058201058201058205
"For my afternoon snack, I had 14g of smooth hounds, 3.4g of potatoes, and a minuscule 1g portion of maize grain-based mixed snacks.",0.006849470697272824,0.047785547785547784,0.000947674578887878,0.01436130007558579
"During my afternoon snack, I enjoyed 12g of breadsticks alongside 6g of baked milk snacks.",0.0538737214458574,0.025807525807525804,0.01723044688887051,0.05517762660619804
"For a quick snack, I had 50g of delicious home-fried potatoes paired with 4g of zesty tomato ketchup and 2g of creamy mayonnaise sauce.",0.11626537439986179,0.045787545787545784,0.17747360295536624,0.2290249433106576
"For my snack, I had 34.5g of purple mombin plums.",0.03253498581204591,0.005661005661005661,0.0006030656411104678,0.021164021164021163
"As a quick snack, I savored 59.5g of delicious medlars.",0.03319358876370676,0.0029970029970029966,0.0,0.021164021164021163
"During my snack time, I enjoyed 79.7g of small miscellaneous fruits with inedible peel from the Patawa source.",0.11758258030318348,0.03712953712953713,0.144908058335401,0.1851851851851852
"For my snack, I had 190g of sweetened semi-skimmed yoghurt drink, 22g of processed maize-based flakes with added sugar, and 258g of common banana.",0.44899158557892244,0.1713286713286713,0.039630027844402164,0.34618291761148906
I snacked on 35.1g of delicious apples with the peel and 185.5g of ripe mangoes.,0.15490341423063156,0.01415251415251415,0.0033599371433297495,0.09750566893424037
I enjoyed 18g of red prickly pears as a delightful snack today.,0.012250014900891781,0.0018315018315018313,0.0,0.007558578987150416
"For my snack, I had 52g of freshly fried cow meat.",0.0,0.2502497502497502,0.12629917569542082,0.14512471655328799
"For my snack, I enjoyed a mix of flavors featuring 0.0g of crushed garlic blended with 4.8g of fresh carrots and 9.5g of peeled potatoes. I also had a hearty portion of 11.1g of dried durum pasta, complemented by 22.2g of tender duck meat. To keep hydrated, I sipped on 44.8g of refreshing unbottled water. Lastly, I added some texture with 4.7g of pumpkin, and finished it off with a light drizzle of refined soya bean oil and a pinch of iodized and fluoridated salt.",0.050009917462780426,0.15517815517815517,0.0965766548121192,0.14058956916099774
"For today's lunch, I savored 36.6g of fresh beef complemented by 61.7g of onions.",0.030603083820507422,0.14418914418914416,0.0061168086455490305,0.05139833711262283
"Today, I snacked on 24.7g of sweet potatoes, carefully peeled and ready to eat.",0.029944480868846577,0.004995004995004994,0.0004307611722217627,0.021919879062736205
"During my snack time, I savored a 110g common banana, which was both tasty and satisfying.",0.11398221750077084,0.01648351648351648,0.003790698315551512,0.07558578987150416
"During my snack, I savored 140.2g of Andigena potatoes with the peel and 70.4g of freshly cooked hen eggs.",0.11371877632010649,0.2047952047952048,0.05625740909216221,0.13151927437641725
"My snack consisted of 156.2g of fresh spiced sausages in casing, served with a drizzle of 20.1g of virgin olive oil, along with 245.1g of unprocessed main-crop potatoes, 45g of white bread, and 360g of tap water for hydration.",0.32895022092287174,0.5507825507825507,0.5550788465249635,0.7513227513227514
"For my snack, I took 4g of a combination of vitamin and mineral supplements that included Vitamin A, D, C, B1, and E.",0.0,0.0,0.0,0.0
"For breakfast, I had 0.4g of whole liquorice extract, including its artificial forms.",0.0013611127667657534,0.00033300033300033295,0.0001723044688887051,0.0015117157974300832
"For a nutritious boost, I took 16g of mineral-only supplements in fine powder for my snack.",0.067528755976959,0.0,0.0,0.04383975812547241
"For breakfast today, I enjoyed a hint of 0.8g aromatic herbs paired with 40g of bottled drinking water.",0.0007464166785489617,0.0009990009990009988,0.0006030656411104678,0.0015117157974300832
"As a light snack, I added 0.4g of fluorine drops to my routine.",0.0,0.0,0.0,0.0
"For a quick snack, I prepared 45g of white bread, toasted with 17.6g of cooked pork ham and 17.6g of gouda cheese, generously spread with 10g of mayonnaise, alongside 100g of unprocessed Cavendishes and a cold 330g cola.",0.3180174119253017,0.2239427239427239,0.16567074683648994,0.3756613756613757
"I started my day with a delightful 16g serving of a ready-to-eat dairy meal designed for children, combining yoghurt, cow milk, and sweet Cavendishes.",0.01290861785255263,0.0026640026640026636,0.0008615223444435254,0.009826152683295541
"For lunch, I had 6g of unprocessed lemons with peel, a generous 250g of black tea infusion without added sugar, 50g of toasted white wheat bread, and some table-top sweeteners, although I didn't measure the exact amount.",0.1526202573315406,0.07842157842157842,0.0021538058611088136,0.11337868480725624
"For a little pick-me-up during my snack, I opted for 5.9g of vitamin tablets from STATE.",0.0,0.0,0.0005169134066661152,0.0007558578987150416
"For my snack, I took 0.8g of fish oil tablets that are rich in special fatty acids like Omega-3.",0.0003512549075524525,0.0026640026640026636,0.004307611722217627,0.003779289493575208
"For a healthy snack, I chose to take 5g of iron tablets from STATE to support my nutrition.",0.0,0.0,0.0,0.0
"As a healthy snack, I consumed 5g of tablets that combine essential vitamins and minerals, including calcium and vitamin D.",0.0,0.0,0.0,0.0
"For my snack, I took 1.5g of a combination of vitamin and mineral supplements containing ginseng.",0.0013611127667657534,0.004828504828504828,0.003963002784440217,0.005291005291005291
I kicked off my breakfast with a delicious 165g kaki.,0.11591411949230931,0.01648351648351648,0.004307611722217627,0.08087679516250945
"I opted for a 39g serving of STATE protein and amino acids supplement as my snack today, keeping my energy levels up.",0.024060961167343,0.5194805194805194,0.011027486008877126,0.11866969009826153
"This morning, my breakfast included 160g of GEN spirits, paired with 40g of freshly toasted peanuts and 20g of crispy salty sticks.",0.07736389338842767,0.2171162171162171,0.2141744548286604,0.5510204081632654
"During my afternoon snack, I enjoyed a small dose of 1.1g of ginseng tablets, which are part of my herbal formulations.",0.0,0.0,0.0,0.0
"To tide me over, I took 0.2g of STATE vitamin drops as my snack.",0.0,0.0,0.0,0.0
My snack consisted of an interesting 0.5g serving of non-food matrices.,0.0,0.0,0.0,0.0
"For breakfast, I had 10.5g of fine powder camomile tea designed for infants, sweetened with common sugar, alongside 150g of peeled apples.",0.1344428158657012,0.007492507492507492,0.001292283516665288,0.09145880574452003
"For breakfast, I had 170g of raw Florence fennels, fresh and crisp.",0.007464166785489616,0.03396603396603396,0.0,0.011337868480725623
"During my snack time, I enjoyed 60g of weak-strength coffee with no sugar added, 24g of crunchy rusk, and a sprinkle of 8g of sucrose.",0.12447595786390037,0.04612054612054611,0.012405921759986765,0.0982615268329554
"For lunch, I enjoyed a light meal featuring 9g of choux pastry dough, along with sliceable cooked sausages and fresh leafy greens.",0.02015325032082196,0.01515151515151515,0.017144294654426157,0.02947845804988662
"For lunch, I had a 500g micronutrients supplement designed for sports people, which comes in a liquid form and is made up of various chemical elements.",0.13655034531101592,0.0,0.0012061312822209357,0.08692365835222979
I opted for a 0.2g tablet of State protein and amino acids for a light snack today.,0.0006586029516608484,0.00016650016650016647,8.615223444435255e-05,0.0007558578987150416
"For my snack, I took 1.2g of calcium tablets to boost my mineral intake.",0.0004829754978846222,0.0,8.615223444435255e-05,0.0007558578987150416
"For my snack, I took 4.9g of State vitamin and mineral tablets.",0.0027661323969755637,0.0,0.0,0.0015117157974300832
"For a little pick-me-up, I had 0.8g of vitamin powder from STATE during my snack.",0.0,0.003496503496503496,0.0002584567033330576,0.0007558578987150416
"For a light snack, I opted for 6g of magnesium powder, making it easy to stay healthy.",0.0,0.0,0.0,0.0
"My snack today included 60g of Tiroler speck, 150g of sweet unprocessed melons, 15g of light and crispy white flour crackers, and a large glass of 480g natural mineral water to keep me hydrated.",0.09510226621982652,0.3333333333333333,0.12853913379097398,0.22448979591836735
I enjoyed a snack of 0.8g of mixed vitamin tablets that contained various herbal extracts.,0.0007903235419930181,0.0021645021645021645,0.003101480439996691,0.0030234315948601664
"For a quick snack, I savored 60g of QUAL espresso coffee and indulged in a 28g portion of sponge cake that was prepared with jam.",0.08715512393645228,0.029637029637029633,0.01998731839108979,0.07709750566893424
My afternoon snack consisted of 250g of creamy semi-skimmed cow milk and a delightful 10g of honey.,0.09014079065064813,0.1466866466866467,0.032307087916632206,0.10959939531368103
"At dinner, I savored 150g of camomile infusion, enhanced with 1.2g of sweeteners in powder form, combining both fructose and saccharin for a pleasant touch.",0.006717750106940654,0.00016650016650016647,0.0,0.005291005291005291
"This morning, my breakfast included 156g of finger food, a delightful blend of rice flour and pulses flour, served with 90g of rich dal curry sauce.",0.21984166526439122,0.2201132201132201,0.04824525128883742,0.22600151171579744
"My snack included 77g of tasty fried finger food made from lentils, 94g of fish-filled savory pie, and a 210g glass of invigorating fermented tea infusion.",0.19946888062634896,0.2047952047952048,0.25414909161084,0.3673469387755102
"For my snack, I had 32g of white wheat bread and rolls made from refined flour, accompanied by 350g of refreshing tap water and 300g of liquid milk.",0.133520771733376,0.21528471528471527,0.05393129876216469,0.17460317460317462
"For a quick snack, I indulged in 39g of toffee with wheat semolina and complemented it with 210g of a rich coffee beverage.",0.07551980512377729,0.031135531135531132,0.028774846304413747,0.07936507936507936
"This morning, my meal consisted of 69g of assorted root and tuber vegetables.",0.01747493165073451,0.015318015318015316,0.0014645879855539933,0.01436130007558579
"I treated myself to 215g of unspecified fruit for my snack, a delightful and healthy choice.",0.15103961024755458,0.027139527139527136,0.004221459487773274,0.10052910052910054
"My lunch consisted of 30g of shrimp and prawns, 61g of flavorful broiled chicken breast, 200g of perfectly fried rice, and a fizzy 350g cola to enjoy alongside the meal.",0.4793751350822096,0.41908091908091905,0.14060044661318336,0.5154950869236584
"During my afternoon snack, I enjoyed a hearty 250g of fortified malt coffee ingredient paired with 75g of crunchy biscuits.",0.9759617606344893,0.4748584748584748,0.3067881068563394,1.0
"For a delightful snack, I savored 30g of crackers and breadsticks crafted from white wheat flour, along with 129g of delicious hog plums.",0.14945896316356855,0.048784548784548784,0.07314324704325531,0.15192743764172337
"This evening, my meal featured 50g of Asian-style noodles other than glass noodles paired with 44g of whole eggs.",0.021514363087587716,0.10522810522810522,0.0475560334132826,0.07331821617535904
"I kicked off my day with a hearty 400g serving of finger food, featuring rice flour and coconuts, cooked through fermentation and shallow frying.",0.9583990152568667,0.25774225774225773,0.4011248035729055,0.982615268329554
"For my snack, I had 351g of delicious granate apples.",0.22576909182933885,0.08291708291708291,0.0033599371433297495,0.14588057445200303
"For my snack, I had 30g of carambolas alongside 134g of common banana.",0.16271883592367364,0.0308025308025308,0.006978330989992555,0.11337868480725624
"This afternoon, my snack consisted of 16g of cooked French beans, 15g of mixed Asiatic pennywort vegetables, and a hearty 200g serving of polished rice cooked in water.",0.25536231779063295,0.10089910089910088,0.014818184324428638,0.21012849584278157
"Today for a snack, I savored 69g of finger food featuring a mix of millet flour, rice flour, and coconut, all harmoniously balanced with refined cane sugar.",0.12618832553821854,0.026973026973026972,0.04333457392550933,0.12093726379440665
I enjoyed a delightful 350g of elephant apples as my afternoon snack.,0.1993371600360168,0.17998667998667997,0.10915488104099468,0.20634920634920637
"For breakfast, I savored 80g of food industry prepared pancakes.",0.11591411949230931,0.07492507492507491,0.07495244396658671,0.1526832955404384
"For dinner, I savored 276.2g of Nonis.",0.20416691501486303,0.04662004662004661,0.0068921787555482035,0.13756613756613756
"Breakfast today consisted of 38.5g of cereals enriched with probiotic cultures, combined with 300g of low-fat cow milk.",0.19362926778828946,0.21645021645021642,0.0542759076999421,0.21541950113378686
"For my dinner, I enjoyed 27.9g of delicious fried white onions, drizzled with 6.1g of safflower seed oil, alongside 100g of savory processed whole beef products.",0.011415784495454707,0.5677655677655676,0.18091969233314034,0.25547996976568405
"During my snack time, I enjoyed 348g of celery, paired with 51g of sweet pineapple and 97g of prickly pear stems for a unique taste.",0.08869186415699426,0.0666000666000666,0.006892178755548203,0.07407407407407407
"For dinner, I had 1.5g of brown sugar, 62.4g of flavored bottled water with added sugar, 63.9g of light yellow cheese, and 56g of white tortilla.",0.14225823755874326,0.10989010989010987,0.13095139635541586,0.22071050642479215
"I treated myself to a delightful 92g serving of industry-prepared chocolate, made with common sugar, for a quick snack.",0.31437314225944496,0.05827505827505827,0.10424420367766657,0.309145880574452
"To start my day, I had 40g of probiotic milk-like drink with added sugar and a scrumptious 55.2g biscuit filled with jam.",0.22436407219912904,0.0849150849150849,0.08787527913323959,0.23960695389266817
"This morning, I enjoyed a hearty breakfast featuring 270g of unsweetened low-fat evaporated milk alongside a delicious 56g piece of fortified plain cake.",0.2959322596129413,0.3596403596403596,0.11285942712210183,0.35827664399092973
"For breakfast, I had 39g of a biscuit filled with foamed sugar products like marshmallows, paired with 229.9g of a light yogurt drink, and a refreshing 213.7g soya drink with added sugar.",0.24851284709336016,0.16816516816516813,0.04049155018884569,0.23356009070294786
"This morning, my breakfast consisted of a smooth 381.9g liquid supplement that provided a rich blend of vitamins and minerals, including Vitamin B12 and potassium, to kickstart my day.",0.15630843386084137,0.4095904095904096,0.07236787693325614,0.23885109599395316
"This afternoon, my snack consisted of 90g of dairy snacks made with a blend of sugars, paired with 3.6g of hard candies for a little extra sweetness.",0.07947142283374238,0.08658008658008658,0.02326110329997519,0.08843537414965986
I started my day with a delightful breakfast consisting of 130g of sweet plain biscuits and 343.5g of milk that was boiled and sweetened with sucrose.,0.5260042240597976,0.3446553446553446,0.1998731839108979,0.5835222978080121
"For a wholesome snack, I had 382.2g of milk fortified with a blend of vitamins and minerals to keep me energized.",0.07859328556486124,0.19813519813519812,0.09907506961100543,0.16780045351473924
"This morning, my breakfast included 10g of cereals made from common wheat, 20g of infant formula powder, and a generous 180g of drinking water.",0.08605745235035087,0.05827505827505827,0.04393763956661979,0.10430839002267574
"For dinner, I had 257.6g of fortified milk enriched with vitamins and minerals, a sprinkle of 0.2g cinnamon powder, and 31.2g of boiled rolled oats.",0.1431363748276244,0.19647019647019645,0.08529071209990902,0.20256991685563114
"My afternoon snack featured 35g of white bread, 12g of flavorful boiled turkey, and a creamy 4.5g serving of mayonnaise.",0.09571696230804332,0.0849150849150849,0.03790698315551512,0.11186696900982615
"During my lunch today, I enjoyed a hearty mix of 127.5g boiled chicken, 58.2g boiled potatoes, and 44.7g boiled courgettes, rounded out with 66.7g of maize flour and a generous portion of 200g of unleavened dough, all enhanced by a touch of garlic at 0.3g.",0.5571780971050778,0.5977355977355977,0.22399580955531662,0.671957671957672
"For tonight's dinner, I had a light 2.5g tortilla made from white maize, a touch of 1.9g plain cream, 12g of romaine, and a satisfying 14.5g portion of low-fat fresh sheep meat.",0.0074641667854896164,0.05161505161505161,0.014645879855539931,0.025699168556311415
"At snack time, I indulged in 10.5g of baked milk that was prepared in the food industry.",0.025465980797552804,0.011655011655011652,0.006030656411104678,0.02418745275888133
"My snack featured a delightful spread of 39.2g of ham, perfectly pan-fried to bring out its savory flavor, accompanied by 164.7g of fried eggs, cooked to a fluffy perfection. All of this was brought together with a touch of 4.6g of rapeseed oil and a dash of salt for added seasoning. To complement the meal, I enjoyed a refreshing 517.2g of orange juice, a delicious nectar made from fresh oranges, served alongside 207.6g of soft tortillas made from maize grain, creating a satisfying and flavorful snack experience.",0.6853861383617229,0.6177156177156177,0.3239324015107656,0.8450491307634165
"My breakfast featured 175.6g of delicious boiled banana complemented by 257.6g of rich, lactose-free boiled whole milk.",0.23051103308129695,0.16317016317016317,0.04479916191106332,0.2108843537414966
I kicked off my day with breakfast featuring 206.1g of vitamin-fortified milk powder and a rich 203g serving of chocolate made with sugar.,0.7363180999568285,0.2364302364302364,0.2825793289774764,0.7732426303854876
"For breakfast, I had 308.8g of sweetened and flavored yoghurt drinks alongside 128g of a deliciously prepared Berliner doughnut.",0.4886833901323495,0.33633033633033627,0.28688694069969395,0.6243386243386243
"For breakfast today, I savored 60.8g of tasty chicken wings complemented by a comforting 222.9g of mixed vegetable soup flavored with chicken stock.",0.024587843528671674,0.2447552447552447,0.07667548865547376,0.12471655328798187
"For dinner, I savored 18.7g of fresh uncured cheese and 85.5g of flavorful medium-fat beef that was cooked to perfection.",0.002195343172202828,0.31468531468531463,0.18178121467758387,0.20786092214663643
"This morning, I enjoyed a creamy 199.7g serving of condensed milk alongside a sweet 30g biscuit filled with cinnamon goodness.",0.6796782461139955,0.18315018315018314,0.15679706668872165,0.6250944822373394
"For my snack, I savored a colorful plate with 101.6g of boiled broccoli, 6.0g of boiled spinach, 3.5g of white boiled onions, 13.6g of boiled carrots, 38.4g of boiled courgettes, and 45.2g of plum tomatoes, all seasoned to perfection with 42.1g of seasoning salt, making it a vibrant and flavorful combination.",0.18484789509947813,0.1798201798201798,0.0077537010999917284,0.14890400604686319
"This morning's breakfast included a 50g portion of a delicious vegetable-based meal for kids, featuring courgettes in a smooth puree form.",0.004829754978846222,0.0,0.0,0.0030234315948601664
"During my snack time, I enjoyed 70g of refined white bread with 19.6g of pork ham and a drizzle of 3g mayonnaise, along with a refreshing 265g of prepared fruit and vegetable juice.",0.32798426992710256,0.1465201465201465,0.07064483224436909,0.29327286470143615
"For lunch, I had 170g of a ready-to-eat fruit-based puree meal for children, prepared by the food industry.",0.17167583606626116,0.10989010989010987,0.062029608799933834,0.18669690098261527
"At breakfast, I savored 16.8g of delicious crackers and breadsticks, made with edible vegetable fats and a sprinkle of salt, paired with 1g of leaves for my warm infusion.",0.04917568705734335,0.019980019980019977,0.029291759711079862,0.06046863189720333
"For a quick snack, I indulged in 36.2g of pork lard skin that was deep-fried and paired it with 151.8g of soft and warm maize dough.",0.2120701504347932,0.43290043290043284,0.14732032089984282,0.34089191232048377
"I enjoyed 47.8g boiled eggs, 3.9g vegetable, and a 69.2g tortilla with 0.2g salt and 10.1g sugar. In addition, I hvae 36.2g strawberries and 172.6g cow milk.",0.2353407880601432,0.25807525807525805,0.1395666197998511,0.3167044595616024
"For my snack, I enjoyed a refreshing 100g of drinking water, a satisfying 44g of chocolate-coated biscuits with a delightful filling, a light serving of 46g of crunchy corn chips, and a fluffy 100g yeast-leavened pastry. I also indulged in a piece of sweetened chewing gum weighing 5.4g, rounding off my snack with a burst of flavor.",0.4728769192924892,0.2414252414252414,0.337716759021862,0.636432350718065
"This morning's breakfast consisted of 14.3g of orange juice, 98.4g of chicken leg with skin, seasoned with 0.4g of salt, 2g of edible vegetable fats, 13.1g of fermented sauce, a touch of 1.2g lime juice, and a sprinkle of 0.5g garlic for flavor.",0.01844088264650376,0.28638028638028634,0.1723044688887051,0.20332577475434618
"This morning, I started my day with a cup of coffee made from 3g of roasted grounds, blended with 18.9g of white sugar, and washed it down with 333.3g of water, complemented by a 72g tortilla.",0.23797519986678659,0.0616050616050616,0.020676536266644608,0.1851851851851852
"I treated myself to a 99g ready-to-eat mixed meal designed for kids, which included a delightful puree of ham and vegetables, accompanied by 25.5g of hearty bean soup for my snack.",0.04127245163741317,0.03829503829503829,0.016368924544426983,0.04761904761904762
"Tonight's dinner featured 121g of dry peas, providing a wholesome and filling option.",0.3104215245494799,0.4312354312354312,0.020676536266644608,0.30839002267573695
"This morning, my breakfast included a small portion of 13.8g boiled hog plums and a refreshing 126g glass of industry-prepared grape juice.",0.08605745235035087,0.001665001665001665,0.0017230446888870509,0.06046863189720333
"At snack time, I enjoyed 333.3g of boiling drinking water and brewed it with 3.6g of roasted coffee grounds. I added 18.9g of white sugar for sweetness and savored a 35g artisan pastry made with sucrose.",0.1712367674318206,0.02664002664002664,0.06978330989992555,0.16250944822373395
"This morning's breakfast consisted of 8g of cocoa beverage made from sugar and vitamins, a refreshing 125.7g of flavored milk, and a satisfying 30g of integral extruded cereal.",0.16421166928077158,0.1381951381951382,0.022399580955531663,0.1564625850340136
"For my dinner, I prepared 40.6g of ripe pumpkin and complemented it with 127.4g of light cow milk.",0.03732083392744808,0.07492507492507491,0.011199790477765832,0.04686318972033258
"For my dinner, I savored 82.6g of prickly pear stems sautéed with a mix of spices and 43.2g of tangy cured pork fat prepared with vinegar and dried chili.",0.013611127667657536,0.09990009990009989,0.15076641027761695,0.14436885865457294
